{
  "schema_version": 1,
  "mission_id": "M-147",
  "state": "merged",
  "pr_number": 156,
  "pr_url": "https://github.com/DataDave-Dev/weftmap/pull/156",
  "pr_head_oid": "61c9e8de3d36ec9bcca22fb6185668aa68666c66",
  "base_branch": "main",
  "head_drift": false,
  "ci_state": "success",
  "merge_commit_oid": "78b15ee5de214bbb9c5a8bcbea4248425cc76685",
  "review_decision": null,
  "decision_url": null,
  "opened_at": "2026-07-16T22:49:33Z",
  "closed_at": "2026-07-25T03:10:29Z",
  "updated_at": "2026-07-25T03:10:29Z",
  "observed_at": "2026-07-25T10:31:37Z",
  "correction_note": null,
  "scope_note": "The receipt proves the declared automated checks only; maintainer review and merge remain independent human decisions.",
  "bundle_digest": "sha256:378a173ad385ca3dae0c34cbb753b089f380d2d99c0e7b48219fa3bc7ecb235b",
  "attestation_uri": "https://github.com/northset-oss/verification-pilot/releases/download/run-record-M-147-378a173ad385/run-record-M-147-378a173ad385.tar.gz",
  "release_asset_sha256": "sha256:307efa5bf1005173de6760660d9b6f9882b90d920706bf548c4a271e204485b4",
  "attestation_verified_at": "2026-07-16T22:49:26.958Z",
  "pr_disclosure": {
    "schema_version": 1,
    "required": true,
    "mode": "pr_body",
    "canonical_url": "https://northset-oss.github.io/verification-pilot/receipts/M-147/",
    "verified_at": "2026-07-17T11:46:31.485Z"
  }
}
